{
	"$schema": "https://json-schema.org/draft/2020-12/schema",
	"type": "object",
	"additionalProperties": false,
	"required": [
		"schemaVersion",
		"stage",
		"capturedAt",
		"run",
		"source",
		"host",
		"repository",
		"commands",
		"guards",
		"suites",
		"renderFixtures",
		"live",
		"coverage",
		"rollback"
	],
	"properties": {
		"schemaVersion": { "type": "integer", "const": 1 },
		"stage": { "type": "string", "const": "stage-10b-telemetry" },
		"capturedAt": { "type": "string", "format": "date-time" },
		"run": {
			"type": "object",
			"additionalProperties": false,
			"required": ["id", "logRoot"],
			"properties": {
				"id": { "type": "string", "minLength": 1 },
				"logRoot": {
					"type": "string",
					"const": "evidence/stage-10b-telemetry-run"
				}
			}
		},
		"source": {
			"type": "object",
			"additionalProperties": false,
			"required": [
				"baseSha",
				"implementationSha",
				"treeClean",
				"declaredMode",
				"reservedTelemetryRoot",
				"typescriptCatalogPin"
			],
			"properties": {
				"baseSha": { "$ref": "#/$defs/gitSha" },
				"implementationSha": { "$ref": "#/$defs/gitSha" },
				"treeClean": { "type": "boolean", "const": true },
				"declaredMode": { "type": "string", "const": "skeleton" },
				"reservedTelemetryRoot": {
					"type": "string",
					"const": "libs/observability"
				},
				"typescriptCatalogPin": { "$ref": "#/$defs/version" }
			}
		},
		"host": {
			"type": "object",
			"additionalProperties": false,
			"required": [
				"os",
				"architecture",
				"kernel",
				"insideDevcontainer",
				"bunVersion",
				"gitVersion",
				"ghVersion",
				"redactedEnvironmentKeys"
			],
			"properties": {
				"os": { "type": "string", "minLength": 1 },
				"architecture": { "type": "string", "minLength": 1 },
				"kernel": { "type": "string", "minLength": 1 },
				"insideDevcontainer": { "type": "boolean" },
				"bunVersion": { "$ref": "#/$defs/version" },
				"gitVersion": { "$ref": "#/$defs/version" },
				"ghVersion": { "$ref": "#/$defs/version" },
				"redactedEnvironmentKeys": {
					"description": "The NAMES of every telemetry-credential variable the collector removed from the environment it handed each captured command. Names only, never values: a record that leaked the thing it exists to prove safe would be worse than no record.",
					"type": "array",
					"uniqueItems": true,
					"items": { "type": "string", "minLength": 1 }
				}
			}
		},
		"repository": {
			"type": "object",
			"additionalProperties": false,
			"required": [
				"nameWithOwner",
				"workflowFile",
				"gateJobId",
				"gateContext",
				"gateNeeds",
				"telemetryGuardScript",
				"ciGuardScript",
				"openspecGuardScript",
				"registryFile",
				"capability",
				"addedJobs",
				"workflowSecretReferences"
			],
			"properties": {
				"nameWithOwner": { "type": "string", "minLength": 1 },
				"workflowFile": {
					"type": "string",
					"const": ".github/workflows/ci.yml"
				},
				"gateJobId": { "type": "string", "const": "ci-gate" },
				"gateContext": { "type": "string", "minLength": 1 },
				"gateNeeds": {
					"type": "array",
					"minItems": 2,
					"items": { "type": "string", "minLength": 1 }
				},
				"telemetryGuardScript": {
					"type": "string",
					"const": "telemetry:check"
				},
				"ciGuardScript": { "type": "string", "const": "ci:check" },
				"openspecGuardScript": { "type": "string", "const": "openspec:check" },
				"registryFile": { "type": "string", "const": "external-writes.json" },
				"capability": { "type": "string", "const": "sentry" },
				"addedJobs": { "type": "integer", "const": 0 },
				"workflowSecretReferences": { "type": "integer", "const": 0 }
			}
		},
		"commands": {
			"type": "array",
			"minItems": 15,
			"maxItems": 15,
			"items": { "$ref": "#/$defs/commandResult" }
		},
		"guards": {
			"type": "object",
			"additionalProperties": false,
			"required": ["telemetry", "ci", "openspec"],
			"properties": {
				"telemetry": { "$ref": "#/$defs/guardSummary" },
				"ci": { "$ref": "#/$defs/guardSummary" },
				"openspec": { "$ref": "#/$defs/guardSummary" }
			}
		},
		"suites": {
			"type": "array",
			"minItems": 9,
			"maxItems": 9,
			"items": { "$ref": "#/$defs/suiteCounts" }
		},
		"renderFixtures": {
			"type": "object",
			"additionalProperties": false,
			"required": ["commandId", "fixtures"],
			"properties": {
				"commandId": { "type": "string", "const": "rendered-telemetry" },
				"fixtures": {
					"type": "array",
					"minItems": 3,
					"maxItems": 3,
					"items": {
						"type": "object",
						"additionalProperties": false,
						"required": [
							"name",
							"capabilityEnabled",
							"gatedPaths",
							"packageScripts",
							"telemetryStepPresent",
							"guardPresent",
							"telemetryTokenFiles",
							"telemetryErrors",
							"reservedRootFiles",
							"workflowGuardPresent",
							"residueFindings"
						],
						"properties": {
							"name": { "type": "string", "minLength": 1 },
							"capabilityEnabled": { "type": "boolean" },
							"gatedPaths": {
								"type": "array",
								"items": { "type": "string", "minLength": 1 }
							},
							"packageScripts": {
								"type": "array",
								"items": { "type": "string", "minLength": 1 }
							},
							"telemetryStepPresent": { "type": "boolean" },
							"guardPresent": { "type": "boolean" },
							"telemetryTokenFiles": { "type": "integer", "minimum": 0 },
							"telemetryErrors": {
								"type": "array",
								"maxItems": 0,
								"items": { "type": "string" }
							},
							"reservedRootFiles": { "type": "integer", "const": 0 },
							"workflowGuardPresent": { "type": "boolean", "const": true },
							"residueFindings": {
								"type": "array",
								"maxItems": 0,
								"items": { "type": "object" }
							}
						}
					}
				}
			}
		},
		"live": {
			"type": "object",
			"additionalProperties": false,
			"required": ["live-gate"],
			"properties": {
				"live-gate": {
					"type": "object",
					"additionalProperties": false,
					"required": ["commandId", "heavyLaneRan", "run"],
					"properties": {
						"commandId": { "type": "string", "const": "live-gate" },
						"heavyLaneRan": { "type": "boolean", "const": true },
						"run": {
							"type": "object",
							"additionalProperties": false,
							"required": [
								"runId",
								"url",
								"event",
								"headBranch",
								"headSha",
								"conclusion",
								"gateJobId",
								"gateConclusion",
								"gateLogSha256",
								"upstreamResults",
								"jobs"
							],
							"properties": {
								"runId": { "type": "integer", "minimum": 1 },
								"url": { "type": "string", "minLength": 1 },
								"event": { "type": "string", "const": "pull_request" },
								"headBranch": { "type": "string", "minLength": 1 },
								"headSha": { "$ref": "#/$defs/gitSha" },
								"conclusion": { "type": "string", "const": "success" },
								"gateJobId": { "type": "integer", "minimum": 1 },
								"gateConclusion": { "type": "string", "const": "success" },
								"gateLogSha256": { "$ref": "#/$defs/sha256" },
								"upstreamResults": { "type": "string", "minLength": 1 },
								"jobs": {
									"type": "array",
									"minItems": 1,
									"items": { "$ref": "#/$defs/jobResult" }
								}
							}
						}
					}
				}
			}
		},
		"coverage": {
			"type": "array",
			"minItems": 10,
			"maxItems": 10,
			"items": {
				"type": "object",
				"additionalProperties": false,
				"required": ["id", "task", "reason", "commandIds"],
				"properties": {
					"id": { "type": "string", "minLength": 1 },
					"task": { "type": "string", "minLength": 1 },
					"reason": { "type": "string", "minLength": 40 },
					"commandIds": {
						"type": "array",
						"minItems": 1,
						"items": { "type": "string", "minLength": 1 }
					}
				}
			}
		},
		"rollback": {
			"type": "object",
			"additionalProperties": false,
			"required": [
				"mode",
				"command",
				"outsideTheTree",
				"containerRebuildRequired",
				"scope",
				"proof"
			],
			"properties": {
				"mode": { "type": "string", "const": "atomic" },
				"command": { "$ref": "#/$defs/command" },
				"outsideTheTree": {
					"type": "array",
					"maxItems": 0,
					"items": { "type": "string" }
				},
				"containerRebuildRequired": {
					"description": "True, and unusually so for a stage that adds no runtime surface. `scripts/worktree/contract.toml` names `.devcontainer` — the whole directory — as a definition fingerprint input, and the Dockerfile bakes that directory in as a definition stamp, so the fenced block this stage adds to `.devcontainer/secrets.example` invalidates that layer even though nothing the build reads changed.",
					"type": "boolean",
					"const": true
				},
				"scope": { "type": "string", "minLength": 80 },
				"proof": {
					"type": "object",
					"additionalProperties": true,
					"required": [
						"commandId",
						"predecessorSha",
						"implementationSha",
						"treeMatchesPredecessor",
						"addedPaths",
						"addedPathsRemoved"
					],
					"properties": {
						"commandId": { "type": "string", "const": "rollback-proof" },
						"predecessorSha": { "$ref": "#/$defs/gitSha" },
						"implementationSha": { "$ref": "#/$defs/gitSha" },
						"treeMatchesPredecessor": { "type": "boolean", "const": true },
						"addedPaths": {
							"type": "array",
							"minItems": 4,
							"maxItems": 4,
							"items": { "type": "string", "minLength": 1 }
						},
						"addedPathsRemoved": { "type": "boolean", "const": true }
					}
				}
			}
		}
	},
	"$defs": {
		"gitSha": { "type": "string", "pattern": "^[0-9a-f]{40}$" },
		"sha256": { "type": "string", "pattern": "^[0-9a-f]{64}$" },
		"version": { "type": "string", "minLength": 1 },
		"command": {
			"type": "array",
			"minItems": 1,
			"items": { "type": "string" }
		},
		"commandResult": {
			"type": "object",
			"additionalProperties": false,
			"required": [
				"id",
				"command",
				"runId",
				"startedAt",
				"completedAt",
				"durationMs",
				"stdoutPath",
				"stderrPath",
				"stdoutSha256",
				"stderrSha256",
				"exitCode",
				"status"
			],
			"properties": {
				"id": { "type": "string", "minLength": 1 },
				"command": { "$ref": "#/$defs/command" },
				"runId": { "type": "string", "minLength": 1 },
				"startedAt": { "type": "string", "format": "date-time" },
				"completedAt": { "type": "string", "format": "date-time" },
				"durationMs": { "type": "number", "minimum": 1 },
				"stdoutPath": { "type": "string", "minLength": 1 },
				"stderrPath": { "type": "string", "minLength": 1 },
				"stdoutSha256": { "$ref": "#/$defs/sha256" },
				"stderrSha256": { "$ref": "#/$defs/sha256" },
				"exitCode": { "type": "number", "const": 0 },
				"status": { "type": "string", "const": "pass" }
			}
		},
		"guardSummary": {
			"type": "object",
			"additionalProperties": false,
			"required": ["commandId", "command", "summary"],
			"properties": {
				"commandId": { "type": "string", "minLength": 1 },
				"command": { "type": "string", "minLength": 1 },
				"summary": { "type": "string", "minLength": 20 }
			}
		},
		"suiteCounts": {
			"type": "object",
			"additionalProperties": false,
			"required": ["commandId", "testFile", "passCount", "failCount"],
			"properties": {
				"commandId": { "type": "string", "minLength": 1 },
				"testFile": { "type": "string", "minLength": 1 },
				"passCount": { "type": "number", "minimum": 1 },
				"failCount": { "type": "number", "const": 0 }
			}
		},
		"jobResult": {
			"type": "object",
			"additionalProperties": false,
			"required": ["name", "conclusion"],
			"properties": {
				"name": { "type": "string", "minLength": 1 },
				"conclusion": { "type": "string", "minLength": 1 }
			}
		}
	}
}
