{
	"schemaVersion": 1,
	"stage": "stage-10b-telemetry",
	"capturedAt": "2026-08-07T10:26:47.959Z",
	"run": {
		"id": "stage10b-20260807t102626z-75d5ebcf",
		"logRoot": "evidence/stage-10b-telemetry-run"
	},
	"source": {
		"baseSha": "cdc90904b14f697ce2cc6eca2a6057b4512a4c93",
		"implementationSha": "75d5ebcfe854fa4a2975efdc20086d3429663ff0",
		"treeClean": true,
		"declaredMode": "skeleton",
		"reservedTelemetryRoot": "libs/observability",
		"typescriptCatalogPin": "5.9.3"
	},
	"host": {
		"os": "darwin",
		"architecture": "arm64",
		"kernel": "25.5.0",
		"insideDevcontainer": false,
		"bunVersion": "1.3.13",
		"gitVersion": "2.50.1",
		"ghVersion": "2.59.0",
		"redactedEnvironmentKeys": []
	},
	"repository": {
		"nameWithOwner": "MrChrisRodriguez/devenv",
		"workflowFile": ".github/workflows/ci.yml",
		"gateJobId": "ci-gate",
		"gateContext": "CI gate",
		"gateNeeds": [
			"ci",
			"image",
			"affected",
			"project",
			"moon-graph",
			"browser"
		],
		"telemetryGuardScript": "telemetry:check",
		"ciGuardScript": "ci:check",
		"openspecGuardScript": "openspec:check",
		"registryFile": "external-writes.json",
		"capability": "sentry",
		"addedJobs": 0,
		"workflowSecretReferences": 0
	},
	"commands": [
		{
			"id": "telemetry-guard",
			"command": ["bun", "run", "telemetry:check"],
			"runId": "stage10b-20260807t102626z-75d5ebcf",
			"startedAt": "2026-08-07T10:26:26.480Z",
			"completedAt": "2026-08-07T10:26:27.065Z",
			"durationMs": 585,
			"stdoutPath": "evidence/stage-10b-telemetry-run/telemetry-guard.stdout",
			"stderrPath": "evidence/stage-10b-telemetry-run/telemetry-guard.stderr",
			"stdoutSha256": "bcba6ab855fe63898ca148605540a15fc09a3e619808866c145b435d368f5ef4",
			"stderrSha256": "bac20adb64f4a5df33e63d76185657709615a1058b00084f9dec380c450dd817",
			"exitCode": 0,
			"status": "pass"
		},
		{
			"id": "ci-guard",
			"command": ["bun", "run", "ci:check"],
			"runId": "stage10b-20260807t102626z-75d5ebcf",
			"startedAt": "2026-08-07T10:26:27.068Z",
			"completedAt": "2026-08-07T10:26:27.130Z",
			"durationMs": 62,
			"stdoutPath": "evidence/stage-10b-telemetry-run/ci-guard.stdout",
			"stderrPath": "evidence/stage-10b-telemetry-run/ci-guard.stderr",
			"stdoutSha256": "9cfe650e97435463f535e1a81f5b30b1ab521cfb458af04688f901be57a294f9",
			"stderrSha256": "d183538a63c244d8ba196aa5a8eb1eb4cfc636414a9ba546e4cfb9b3537e4088",
			"exitCode": 0,
			"status": "pass"
		},
		{
			"id": "openspec-guard",
			"command": ["bun", "run", "openspec:check"],
			"runId": "stage10b-20260807t102626z-75d5ebcf",
			"startedAt": "2026-08-07T10:26:27.130Z",
			"completedAt": "2026-08-07T10:26:27.569Z",
			"durationMs": 439,
			"stdoutPath": "evidence/stage-10b-telemetry-run/openspec-guard.stdout",
			"stderrPath": "evidence/stage-10b-telemetry-run/openspec-guard.stderr",
			"stdoutSha256": "e55f644c12bfb940b5562226a7838a2afb637df7a4f3d35bcae721a6e94ebdca",
			"stderrSha256": "dc2c9a83def8b7f64a38d1f5b1ea3cf5e0f4f2695a054e1a20d972ea5d4dd827",
			"exitCode": 0,
			"status": "pass"
		},
		{
			"id": "telemetry-mutations",
			"command": [
				"bun",
				"test",
				"scripts/template/__tests__/telemetry.test.ts"
			],
			"runId": "stage10b-20260807t102626z-75d5ebcf",
			"startedAt": "2026-08-07T10:26:27.570Z",
			"completedAt": "2026-08-07T10:26:33.918Z",
			"durationMs": 6348,
			"stdoutPath": "evidence/stage-10b-telemetry-run/telemetry-mutations.stdout",
			"stderrPath": "evidence/stage-10b-telemetry-run/telemetry-mutations.stderr",
			"stdoutSha256": "ca35b94f2c5b623fccbd1cc9e77eef3e30a6fcf4b045842fc1353f7ae6d8ea32",
			"stderrSha256": "042fadd8bd1b3e28a5930964e654c97fd1d18ee4d8a907f21b8ca6f293613fb6",
			"exitCode": 0,
			"status": "pass"
		},
		{
			"id": "surface-confinement",
			"command": [
				"bun",
				"test",
				"scripts/template/__tests__/telemetry.test.ts",
				"-t",
				"telemetry SDK confinement"
			],
			"runId": "stage10b-20260807t102626z-75d5ebcf",
			"startedAt": "2026-08-07T10:26:33.918Z",
			"completedAt": "2026-08-07T10:26:34.673Z",
			"durationMs": 755,
			"stdoutPath": "evidence/stage-10b-telemetry-run/surface-confinement.stdout",
			"stderrPath": "evidence/stage-10b-telemetry-run/surface-confinement.stderr",
			"stdoutSha256": "ca35b94f2c5b623fccbd1cc9e77eef3e30a6fcf4b045842fc1353f7ae6d8ea32",
			"stderrSha256": "68b5fa8106eb3fa58e4161d61149bcc8a8fefa6f564d690f04ae3b0c3ad7ba1c",
			"exitCode": 0,
			"status": "pass"
		},
		{
			"id": "truth-table",
			"command": [
				"bun",
				"test",
				"scripts/template/__tests__/telemetry.test.ts",
				"-t",
				"the upload truth table"
			],
			"runId": "stage10b-20260807t102626z-75d5ebcf",
			"startedAt": "2026-08-07T10:26:34.673Z",
			"completedAt": "2026-08-07T10:26:35.534Z",
			"durationMs": 861,
			"stdoutPath": "evidence/stage-10b-telemetry-run/truth-table.stdout",
			"stderrPath": "evidence/stage-10b-telemetry-run/truth-table.stderr",
			"stdoutSha256": "ca35b94f2c5b623fccbd1cc9e77eef3e30a6fcf4b045842fc1353f7ae6d8ea32",
			"stderrSha256": "48a9d02932f2875fd6358b60b17518dcf538b3ab5ac451bbdc6bc29f28f02780",
			"exitCode": 0,
			"status": "pass"
		},
		{
			"id": "scrub-policy",
			"command": [
				"bun",
				"test",
				"scripts/template/__tests__/telemetry.test.ts",
				"-t",
				"scrubbing policy"
			],
			"runId": "stage10b-20260807t102626z-75d5ebcf",
			"startedAt": "2026-08-07T10:26:35.534Z",
			"completedAt": "2026-08-07T10:26:36.289Z",
			"durationMs": 755,
			"stdoutPath": "evidence/stage-10b-telemetry-run/scrub-policy.stdout",
			"stderrPath": "evidence/stage-10b-telemetry-run/scrub-policy.stderr",
			"stdoutSha256": "ca35b94f2c5b623fccbd1cc9e77eef3e30a6fcf4b045842fc1353f7ae6d8ea32",
			"stderrSha256": "136414e64ce28b37902cbdf9f26fde44b6d3be920e4d5d6b7d44ee3185351945",
			"exitCode": 0,
			"status": "pass"
		},
		{
			"id": "credential-literals",
			"command": [
				"bun",
				"test",
				"scripts/template/__tests__/telemetry.test.ts",
				"-t",
				"credential literals"
			],
			"runId": "stage10b-20260807t102626z-75d5ebcf",
			"startedAt": "2026-08-07T10:26:36.289Z",
			"completedAt": "2026-08-07T10:26:36.783Z",
			"durationMs": 494,
			"stdoutPath": "evidence/stage-10b-telemetry-run/credential-literals.stdout",
			"stderrPath": "evidence/stage-10b-telemetry-run/credential-literals.stderr",
			"stdoutSha256": "ca35b94f2c5b623fccbd1cc9e77eef3e30a6fcf4b045842fc1353f7ae6d8ea32",
			"stderrSha256": "d387e75c29afdfd7c3e47299b971cb48e8e79eacb26240a9931eec9ce4d62a3c",
			"exitCode": 0,
			"status": "pass"
		},
		{
			"id": "allowlist-matrix",
			"command": [
				"bun",
				"test",
				"scripts/template/__tests__/telemetry.test.ts",
				"-t",
				"the host allowlist"
			],
			"runId": "stage10b-20260807t102626z-75d5ebcf",
			"startedAt": "2026-08-07T10:26:36.784Z",
			"completedAt": "2026-08-07T10:26:36.804Z",
			"durationMs": 20,
			"stdoutPath": "evidence/stage-10b-telemetry-run/allowlist-matrix.stdout",
			"stderrPath": "evidence/stage-10b-telemetry-run/allowlist-matrix.stderr",
			"stdoutSha256": "ca35b94f2c5b623fccbd1cc9e77eef3e30a6fcf4b045842fc1353f7ae6d8ea32",
			"stderrSha256": "c9273942421ed73585aee8f2da61bf8d74192f76752332014c2e3ecf55906e8d",
			"exitCode": 0,
			"status": "pass"
		},
		{
			"id": "outage-and-final-state",
			"command": [
				"bun",
				"test",
				"scripts/template/__tests__/telemetry.test.ts",
				"-t",
				"truth table, executed"
			],
			"runId": "stage10b-20260807t102626z-75d5ebcf",
			"startedAt": "2026-08-07T10:26:36.805Z",
			"completedAt": "2026-08-07T10:26:36.980Z",
			"durationMs": 175,
			"stdoutPath": "evidence/stage-10b-telemetry-run/outage-and-final-state.stdout",
			"stderrPath": "evidence/stage-10b-telemetry-run/outage-and-final-state.stderr",
			"stdoutSha256": "ca35b94f2c5b623fccbd1cc9e77eef3e30a6fcf4b045842fc1353f7ae6d8ea32",
			"stderrSha256": "19244e7acbf9db173868197100b5cf5ce2dfef23b82828930ca7d46272204998",
			"exitCode": 0,
			"status": "pass"
		},
		{
			"id": "workflow-secret-rules",
			"command": [
				"bun",
				"test",
				"scripts/template/__tests__/ci.test.ts",
				"-t",
				"known-bad ci mutations"
			],
			"runId": "stage10b-20260807t102626z-75d5ebcf",
			"startedAt": "2026-08-07T10:26:36.981Z",
			"completedAt": "2026-08-07T10:26:40.247Z",
			"durationMs": 3266,
			"stdoutPath": "evidence/stage-10b-telemetry-run/workflow-secret-rules.stdout",
			"stderrPath": "evidence/stage-10b-telemetry-run/workflow-secret-rules.stderr",
			"stdoutSha256": "ca35b94f2c5b623fccbd1cc9e77eef3e30a6fcf4b045842fc1353f7ae6d8ea32",
			"stderrSha256": "4ee66afe4d6a0b991f88273b2f86bad2906d597ee678990efdd64d7594dff407",
			"exitCode": 0,
			"status": "pass"
		},
		{
			"id": "archive-readback",
			"command": [
				"bun",
				"test",
				"scripts/template/__tests__/openspec.test.ts",
				"-t",
				"readback"
			],
			"runId": "stage10b-20260807t102626z-75d5ebcf",
			"startedAt": "2026-08-07T10:26:40.248Z",
			"completedAt": "2026-08-07T10:26:41.153Z",
			"durationMs": 905,
			"stdoutPath": "evidence/stage-10b-telemetry-run/archive-readback.stdout",
			"stderrPath": "evidence/stage-10b-telemetry-run/archive-readback.stderr",
			"stdoutSha256": "ca35b94f2c5b623fccbd1cc9e77eef3e30a6fcf4b045842fc1353f7ae6d8ea32",
			"stderrSha256": "417f7802dca878bccb259b3a5d597e90faa96e4973e7e9434fdb4f15195b0e1c",
			"exitCode": 0,
			"status": "pass"
		},
		{
			"id": "rendered-telemetry",
			"command": [
				"bun",
				"scripts/template/collect-stage-ten-b-evidence.ts",
				"probe-render-telemetry",
				"--workspace",
				"/tmp/devenv-stage10b-20260807t102626z-75d5ebcf-render"
			],
			"runId": "stage10b-20260807t102626z-75d5ebcf",
			"startedAt": "2026-08-07T10:26:41.153Z",
			"completedAt": "2026-08-07T10:26:41.969Z",
			"durationMs": 816,
			"stdoutPath": "evidence/stage-10b-telemetry-run/rendered-telemetry.stdout",
			"stderrPath": "evidence/stage-10b-telemetry-run/rendered-telemetry.stderr",
			"stdoutSha256": "9e20161041cea7884233745baa8f732ceef487f5baaad0a7111057f1765495b9",